Project Name,Short Description,Project URL,Try it Out Links
Fluid E-Commerce Product Vision,A polished vision for the future of e-commerce on the spatial web.,https://devpost.com/software/fluid-e-commerce-product-vision,No links available
Drawing Inpiration,Drawing Inspiration: Boost your decor confidence: Sketch in mixed reality and watch as AI transforms your ideas into inspiring wall art you’d feel confident commissioning or buying.,https://devpost.com/software/drawing-inpiration,"https://github.com/billatgameology/meta-aws-hackathon, https://docs.google.com/presentation/d/1VMMKzc7S6PWfLy5Sl1F9YJH8LpmYzUS_/edit#slide=id.p1"
Magic Shoe Box,This immersive mixed reality experience lets you design your dream Nike shoes by describing a design and placing them in a virtual shoe box. It uses SDXL for custom shoe texture generation.,https://devpost.com/software/magic-shoe-box,https://main.d2auiscynrqext.amplifyapp.com/
Mind Palace,Learn language visually in mixed reality,https://devpost.com/software/mind-palace-h8cpsj,No links available
Spatial Moments: Enlightening your travel memories,"“Spatial Moments” turns travel posts into dynamic 3D memories. Users can generate stunning GenAI visuals by inputting text and images, effortlessly enriching and reliving their travel experiences.",https://devpost.com/software/spatial-travel-memory,No links available
Dance Gen XR,"The future of dance with AI and VR! Our cost-effective VR/AR game tailors routines to your level with AI, powered by AWS for seamless performance. Learn, improve, and enjoy—all from home.",https://devpost.com/software/dance-gen-xr,https://github.com/zeuzmakessoftware/dancegenxr-demo
Bondmate,"Bondmate is a Gen AI powered remote worker companion. Bondmate is like a Tamagotchi, but it takes care of you!",https://devpost.com/software/bondmate,No links available
The Future of Interactivity,We're taking real-time interactive entertainment to the next level by combining novel technologies into one solution.,https://devpost.com/software/the-future-of-interactivity,https://sites.google.com/view/modrokkrmainsite/hackathon
CelestialVR,Bringing celestial bodies on chain with Hedera and allowing you to interact with them in VR!,https://devpost.com/software/celestialvr,https://github.com/WilliamUW/CelestialVR
